{"contract_id":"CONTRACT-1","version":"1","epoch":"EPOCH-1","status":"frozen","owner":"domain-a","consumers":["domain-a","domain-b"],"schema_uri":"contracts/shared.schema.json","error_model":"typed error envelope","idempotency":"request key required","ordering":"per aggregate","timeout":"2s","retry":"three exponential retries","compatibility_window":"one release","test_ids":["TEST-CONTRACT-1"],"approval_id":"APP-C1"}
